{
 "version": "0.15.0",
 "generated": "2026-10-11",
 "plays_snapshot": "2026-10-11",
 "method": "Six eras aggregated from api/v1/years.json, data/sessions.json, api/v1/circle.json, api/v1/milestones.json. Signal lines are computed from the same numbers and asserted in scripts/build_transmission.py. The 2026 era carries an extras block: the four verified 2026 singles (data/artist.json discography) and the Q4 2026 watch (the Uncle-LP status passed through from api/v1/scene-figures.json, the trilogy tease from data/artist.json upcoming). Titles and metadata only — never lyrics.",
 "archive_totals": {
  "transmissions": 218,
  "plays": 257394,
  "sessions": 61,
  "years": [
   "2018",
   "2019",
   "2020",
   "2021",
   "2022",
   "2023",
   "2024",
   "2025",
   "2026"
  ]
 },
 "longest_gap": {
  "days": 553,
  "from": "2022-02-22",
  "to": "2023-08-29"
 },
 "eras": [
  {
   "id": "the-first-rite",
   "name": "The First Rite",
   "span": "2017 – 2019",
   "years": [
    "2018",
    "2019"
   ],
   "scene": "The first casting — a guest verse in 2017, then the WoT seal pressed onto Master Key.",
   "transmissions": 79,
   "plays": 220688,
   "sessions": 28,
   "distributor": 4,
   "top_tracks": [
    {
     "title": "Take Me (prod. Em Klebold)",
     "plays": 30088,
     "date": "2018-02-04",
     "page": "releases/take-me-prod-em-klebold.html"
    },
    {
     "title": "Soul Shaking (prod. Fish Narc)",
     "plays": 12944,
     "date": "2018-01-03",
     "page": "releases/soul-shaking-prod-fish-narc.html"
    },
    {
     "title": "candy w/ capoxxo(prod. razorwrist)",
     "plays": 11587,
     "date": "2019-10-04",
     "page": "releases/candy-w-capoxxo-prod-razorwrist.html"
    }
   ],
   "key_sessions": [
    {
     "name": "The February 4th Session",
     "track_count": 1,
     "total_plays": 30088,
     "days": 1,
     "start": "2018-02-04",
     "end": "2018-02-04",
     "deep_dive": null
    },
    {
     "name": "The July 9th Session",
     "track_count": 7,
     "total_plays": 28260,
     "days": 1,
     "start": "2019-07-09",
     "end": "2019-07-09",
     "deep_dive": "sessions/the-july-9th-session.html"
    },
    {
     "name": "The December 22nd Session",
     "track_count": 7,
     "total_plays": 21777,
     "days": 1,
     "start": "2019-12-22",
     "end": "2019-12-22",
     "deep_dive": "sessions/the-december-22nd-session.html"
    }
   ],
   "collaborators": [
    {
     "name": "Yung Vetta",
     "transmissions": 7,
     "plays": 17893,
     "page": "circle/yung-vetta.html"
    },
    {
     "name": "capoxxo",
     "transmissions": 2,
     "plays": 16174,
     "page": "circle/capoxxo.html"
    },
    {
     "name": "JAX",
     "transmissions": 3,
     "plays": 12783,
     "page": "circle/jax.html"
    }
   ],
   "milestones": [
    {
     "id": "first-distributor",
     "name": "First distributor transmission",
     "date": "2017-04-20",
     "title": "lost memories (feat. Aster Da Master)",
     "fact": "The catalog's first appearance on streaming platforms — as a featured artist, two years before the first vault upload."
    },
    {
     "id": "first-vault",
     "name": "First vault transmission",
     "date": "2018-01-03",
     "title": "Soul Shaking (prod. Fish Narc)",
     "fact": "The first upload to the official SoundCloud — and it arrived already carrying five figures of plays. The opening shot was not a warm-up."
    },
    {
     "id": "first-collab",
     "name": "First collaboration",
     "date": "2018-04-28",
     "title": "Mistakes Ft. JO$E DRIPP (prod. Tec)",
     "fact": "The first transmission to summon another voice. The circle starts here and grows to twenty-one collaborators."
    }
   ],
   "signal": "79 transmissions, 220,688 plays — 85.7% of every play in the archive. Two years carried the whole catalog."
  },
  {
   "id": "the-prolific-year",
   "name": "The Prolific Year",
   "span": "2020",
   "years": [
    "2020"
   ],
   "scene": "Three albums in six months — the forge at full heat, eight transmissions in twelve.",
   "transmissions": 23,
   "plays": 12250,
   "sessions": 6,
   "distributor": 8,
   "top_tracks": [
    {
     "title": "used to be messy prod. DeepHartt",
     "plays": 5008,
     "date": "2020-05-03",
     "page": "releases/used-to-be-messy-prod-deephartt.html"
    },
    {
     "title": "I HATE IT prod. Taurs",
     "plays": 1668,
     "date": "2020-04-09",
     "page": "releases/i-hate-it-prod-taurs.html"
    },
    {
     "title": "playin' by the book w/ lil yu (prod. dxsh)",
     "plays": 861,
     "date": "2020-10-07",
     "page": "releases/playin-by-the-book-w-lil-yu-prod-dxsh.html"
    }
   ],
   "key_sessions": [
    {
     "name": "The May 3rd Session",
     "track_count": 1,
     "total_plays": 5008,
     "days": 1,
     "start": "2020-05-03",
     "end": "2020-05-03",
     "deep_dive": null
    },
    {
     "name": "The December 21st Session",
     "track_count": 7,
     "total_plays": 2426,
     "days": 1,
     "start": "2020-12-21",
     "end": "2020-12-21",
     "deep_dive": "sessions/the-december-21st-session.html"
    },
    {
     "name": "The October 7th Session",
     "track_count": 4,
     "total_plays": 1891,
     "days": 1,
     "start": "2020-10-07",
     "end": "2020-10-07",
     "deep_dive": null
    }
   ],
   "collaborators": [
    {
     "name": "lil yu",
     "transmissions": 1,
     "plays": 861,
     "page": "circle/lil-yu.html"
    },
    {
     "name": "phil is lonely",
     "transmissions": 1,
     "plays": 244,
     "page": "circle/phil-is-lonely.html"
    }
   ],
   "milestones": [
    {
     "id": "hundredth-entry",
     "name": "100th transmission on record",
     "date": "2020-12-21",
     "title": "I'm Not Looking For Love Anyway",
     "fact": "The catalog's 100th entry in chronological order — reached before the end of 2020."
    }
   ],
   "signal": "8 distributor releases — the most of any single year — against 23 vault transmissions. (2018 ran 39 vault transmissions with 0 distributor releases.) The catalog's center had moved."
  },
  {
   "id": "the-cast-it-years",
   "name": "The Cast It: Years",
   "span": "2021 – 2022",
   "years": [
    "2021",
    "2022"
   ],
   "scene": "Two volumes of the same spell, cast a year apart — sixteen tracks, then twelve.",
   "transmissions": 28,
   "plays": 4136,
   "sessions": 2,
   "distributor": 3,
   "top_tracks": [
    {
     "title": "Sunvalley Rally ft. Lilrareboy (prod. phantasie)",
     "plays": 319,
     "date": "2021-07-14",
     "page": "releases/sunvalley-rally-ft-lilrareboy-prod-phantasie.html"
    },
    {
     "title": "12 is it working?",
     "plays": 277,
     "date": "2022-02-22",
     "page": "releases/12-is-it-working.html"
    },
    {
     "title": "Beacon (prod. johnnyfriend)",
     "plays": 253,
     "date": "2021-07-14",
     "page": "releases/beacon-prod-johnnyfriend.html"
    }
   ],
   "key_sessions": [
    {
     "name": "The July 14th Session",
     "track_count": 13,
     "total_plays": 2704,
     "days": 1,
     "start": "2021-07-14",
     "end": "2021-07-14",
     "deep_dive": "sessions/the-july-14th-session.html"
    },
    {
     "name": "The February 22nd Session",
     "track_count": 12,
     "total_plays": 1432,
     "days": 1,
     "start": "2022-02-22",
     "end": "2022-02-22",
     "deep_dive": "sessions/the-february-22nd-session.html"
    }
   ],
   "collaborators": [
    {
     "name": "Max Ferrari",
     "transmissions": 3,
     "plays": 536,
     "page": "circle/max-ferrari.html"
    },
    {
     "name": "Lilrareboy",
     "transmissions": 1,
     "plays": 319,
     "page": "circle/lilrareboy.html"
    }
   ],
   "milestones": [
    {
     "id": "hundredth-vault",
     "name": "100th vault transmission",
     "date": "2021-07-14",
     "title": "I Can't Get Myself to Cast (prod. lil biscuit)",
     "fact": "The SoundCloud vault's own 100th upload — mid-2021, deep in the Cast It: years."
    }
   ],
   "signal": "28 transmissions across 2 sessions in two years — the leanest run on record: one transmission about every 26 days."
  },
  {
   "id": "the-somelowlifes-era",
   "name": "The SomeLowLifes Era",
   "span": "2023 – 2024",
   "years": [
    "2023",
    "2024"
   ],
   "scene": "The collective's mark — old rituals re-released, new singles through the year.",
   "transmissions": 58,
   "plays": 14982,
   "sessions": 16,
   "distributor": 12,
   "top_tracks": [
    {
     "title": "Clock In The Benz w/ Lil Yu prod shinju",
     "plays": 725,
     "date": "2023-08-29",
     "page": "releases/clock-in-the-benz-w-lil-yu-prod-shinju.html"
    },
    {
     "title": "On Our Way (Baseline)",
     "plays": 696,
     "date": "2023-11-12",
     "page": "releases/on-our-way-baseline.html"
    },
    {
     "title": "Fleeting n' Geekinggg",
     "plays": 682,
     "date": "2023-11-12",
     "page": "releases/fleeting-n-geekinggg.html"
    }
   ],
   "key_sessions": [
    {
     "name": "The November 3rd–12th Session",
     "track_count": 19,
     "total_plays": 7601,
     "days": 10,
     "start": "2023-11-03",
     "end": "2023-11-12",
     "deep_dive": "sessions/the-november-3rd-12th-session.html"
    },
    {
     "name": "The May 22nd–31st Session",
     "track_count": 5,
     "total_plays": 1420,
     "days": 10,
     "start": "2024-05-22",
     "end": "2024-05-31",
     "deep_dive": null
    },
    {
     "name": "The August 29th Session",
     "track_count": 3,
     "total_plays": 1280,
     "days": 1,
     "start": "2023-08-29",
     "end": "2023-08-29",
     "deep_dive": null
    }
   ],
   "collaborators": [
    {
     "name": "lil yu",
     "transmissions": 1,
     "plays": 725,
     "page": "circle/lil-yu.html"
    },
    {
     "name": "Max Ferrari",
     "transmissions": 1,
     "plays": 515,
     "page": "circle/max-ferrari.html"
    },
    {
     "name": "Max",
     "transmissions": 1,
     "plays": 17,
     "page": "circle/max.html"
    }
   ],
   "milestones": [
    {
     "id": "prolific-day",